{
  "artifact_id": "pilot-327e1f5854bb71af4911",
  "candidates": [],
  "create_neutral_pilot": true,
  "created_at": "2026-07-26T16:15:26Z",
  "evidence_refs": [
    "evidence/pilot/product-contract.json",
    "evidence/pilot/staging-smoke.json"
  ],
  "policy_digest": "8fa83aa61b556c59ccdc3e756c16e51193614ad6d19caadaa39f49f7ac29bc02",
  "producer": {
    "model": null,
    "provider": null,
    "role": "product-selector",
    "tier": "deterministic"
  },
  "product_id": "hermes-factory-pilot",
  "reason": "No existing safe repository was available; neutral credential-free pilot was created.",
  "schema_version": "1.0",
  "selected_repository": null,
  "status": "completed"
}
